<?xml version="1.0" encoding="UTF-8"?>
<list xmlns:xsi="http://www.w3.org/2001/XMLSchema-instance" xsi:noNamespaceSchemaLocation="../../xsd/reflection.xsd">
	<instance id="79" name="Kamaloka Labyrinth of the Abyss (Level 81)" maxChannels="10" collapseIfEmpty="10" timelimit="45" dispelBuffs="true">
		<level min="76" max="85" />
		<party min="2" max="9" />
		<allowSummon val="false" />
		<return x="42767" y="-48016" z="-800" />
		<teleport x="-10700" y="-174882" z="-10936" />
		<reenter setUponEntry="false" sharedReuseGroup="4">
			<reset hour="6" minute="30" />
		</reenter>
	</instance>
</list>