<?xml version="1.0" encoding="UTF-8"?>
<list xmlns:xsi="http://www.w3.org/2001/XMLSchema-instance" xsi:noNamespaceSchemaLocation="../../xsd/reflection.xsd">
	<instance id="62" name="Kamaloka, Hall of the Abyss (Level 36) PC Cafe" maxChannels="10" collapseIfEmpty="10" timelimit="30" dispelBuffs="false">
		<level min="31" max="41" />
		<party min="2" max="6" />
		<allowSummon val="false" />
		<return x="18181" y="145987" z="-3104" />
		<teleport x="-74825" y="-214194" z="-7889" />
		<remove itemId="-100" count="2500" necessary="true" type="ALL" />
		<reenter setUponEntry="false" sharedReuseGroup="3">
			<reset hour="6" minute="30" />
		</reenter>
	</instance>
</list>